{
	"$schema": "../schemas/customer.schema.json",
	"id": "mack",
	"archetype": "regular_minor",
	"name": {
		"en": "Mack O'Shea",
		"ru": "Мэк О'Ши"
	},
	"schedule": {
		"days": [
			3,
			5
		],
		"phases": [
			"Shift"
		],
		"arrival_hour": 18
	},
	"taste": {
		"order": "whiskey_neat",
		"glass": "rocks",
		"acceptable_substitutes": [
			"black_manhattan"
		]
	},
	"persona": {
		"tell": "nervous",
		"mood_baseline": 0.6,
		"patience_baseline": 0.7,
		"will_tell_story": true
	},
	"faction": "syndicate"
}
