{
	"$schema": "../schemas/customer.schema.json",
	"id": "vera",
	"archetype": "regular_minor",
	"name": {
		"en": "Vera Lynch",
		"ru": "Вера Линч"
	},
	"schedule": {
		"days": [
			1,
			2,
			3,
			4,
			5
		],
		"phases": [
			"Shift"
		],
		"arrival_hour": 18
	},
	"taste": {
		"order": "dry_martini",
		"glass": "martini",
		"acceptable_substitutes": []
	},
	"persona": {
		"tell": "fake",
		"mood_baseline": 0.5,
		"patience_baseline": 0.6,
		"will_tell_story": true
	},
	"faction": "syndicate"
}
