{
	"$schema": "../schemas/customer.schema.json",
	"id": "jax",
	"archetype": "regular_minor",
	"name": {
		"en": "Jax Corso",
		"ru": "Джекс Корсо"
	},
	"schedule": {
		"days": [
			5,
			6
		],
		"phases": [
			"Night"
		],
		"arrival_hour": 23
	},
	"taste": {
		"order": "black_manhattan",
		"glass": "rocks",
		"acceptable_substitutes": []
	},
	"persona": {
		"tell": "thirsty",
		"mood_baseline": 0.65,
		"patience_baseline": 0.5,
		"will_tell_story": false
	},
	"faction": "civilian"
}
